{
  "worksheet": "WS4",
  "framework": "UNESCO AI Competency Framework for Teachers (AI-CFT) 2024",
  "note": "Performance-based competency mapping. Strength is a ceiling on observed evidence_strength. Scorer must add item-specific rationale and confidence.",
  "items": {
    "WS4_B1": [
      {
        "lo": "LO3.2.2",
        "strength": "strong",
        "evidence_type": "direct",
        "expected_level": "Deepen",
        "rationale": "Places an improved threshold between adjacent food-card values (avocado / french fries boundary).",
        "role": "primary",
        "portfolio_weight": "full"
      }
    ],
    "WS4_B2": [
      {
        "lo": "LO3.2.2",
        "strength": "strong",
        "evidence_type": "direct",
        "expected_level": "Deepen",
        "rationale": "Identifies all misclassified foods at the prior threshold — error-pattern recognition.",
        "role": "primary",
        "portfolio_weight": "full"
      }
    ],
    "WS4_B3": [
      {
        "lo": "LO3.2.2",
        "strength": "moderate",
        "evidence_type": "direct",
        "expected_level": "Deepen",
        "rationale": "Reflects that misclassification decreased after threshold improvement.",
        "role": "primary",
        "portfolio_weight": "full"
      }
    ],
    "WS4_B4": [
      {
        "lo": "LO3.2.2",
        "strength": "strong",
        "evidence_type": "direct",
        "expected_level": "Deepen",
        "rationale": "Evaluates Pia's claim that equal fat values (apple / raspberry jam) prevent a threshold split.",
        "role": "primary",
        "portfolio_weight": "full"
      }
    ],
    "WS4_B5": [
      {
        "lo": "LO3.2.2",
        "strength": "strong",
        "evidence_type": "direct",
        "expected_level": "Deepen",
        "rationale": "States a learned energy threshold from the food-card dataset (valid range 160–2223).",
        "role": "primary",
        "portfolio_weight": "full"
      }
    ]
  }
}
